"behavior","subdialogue_id","subdialogue_text"
"#0Talk-1st time","17000000","Hmm... Another one of those Unkindled, are you?"
"#0Talk-1st time","17000001","All you faceless Undead, behaving as if you deserve respect."
"#0Talk-1st time","17000002","Hmph. No matter. Heed my words."
"#0Talk-1st time","17000003","If you've any sense, you'll go find a coffin to huddle up inside."
"#0Talk-1st time","17000004","You here, in this land of Hollows,
you're like a frail maiden on the front lines."
"#0Talk-1st time","17000005","If like the others, you're fool enough to play the champion..."
"#0Talk-1st time","17000006","Then go on ahead, traipse right past the abandoned church."
"#0Talk-1st time","17000007","You'll face death, and it won't be pretty."
"#0Talk-1st time","17000008","Enough death to leave you broken, time after time."
"#0Talk-1st time","17000009","..."
"#0Talk-2nd time","17000100","If like the others, you're fool enough to play the champion..."
"#0Talk-2nd time","17000101","Then go on ahead, traipse right past the abandoned church."
"#0Talk-2nd time","17000102","Hopeless, the whole lot of you.
Like little moths, flittering toward a flame."
"#0Talk-2nd time","17000103","..."
"#0Talk-1st time after seeing Irina in the cell & having already talked to him","17000200","You like poking around in cells, do you?"
"#0Talk-1st time after seeing Irina in the cell & having already talked to him","17000201","How very genteel!"
"#0Talk-1st time after seeing Irina in the cell & having already talked to him","17000202","..."
"#0Talk-2nd time after seeing Irina in the cell & having already talked to him","17000300","Ah-hah, taken an interest in her, have you?"
"#0Talk-2nd time after seeing Irina in the cell & having already talked to him","17000301","Well, she's a lost cause.
Couldn't even become a Fire Keeper."
"#0Talk-2nd time after seeing Irina in the cell & having already talked to him","17000302","After I brought her all this way,
and got her all ready."
"#0Talk-2nd time after seeing Irina in the cell & having already talked to him","17000303","She's beyond repair, I tell you."
"#0Talk-2nd time after seeing Irina in the cell & having already talked to him","17000304","..."
"#0Talk-3rd time after seeing Irina in the cell & having already talked to him","17000400","The woman's a lost cause."
"#0Talk-3rd time after seeing Irina in the cell & having already talked to him","17000401","Couldn't even become a Fire Keeper."
"#0Talk-3rd time after seeing Irina in the cell & having already talked to him","17000402","She's beyond repair, I tell you."
"#0Talk-3rd time after seeing Irina in the cell & having already talked to him","17000403","..."
"#0Talk-1st time after visiting Irina's cell before speaking to Eygon","17000500","Hmm... Another one of those Unkindled, are you?"
"#0Talk-1st time after visiting Irina's cell before speaking to Eygon","17000501","All you faceless Undead, behaving as if you deserve respect."
"#0Talk-1st time after visiting Irina's cell before speaking to Eygon","17000502","Now you're poking around in peoples' cells."
"#0Talk-1st time after visiting Irina's cell before speaking to Eygon","17000503","How very noble!"
"#0Talk-1st time after visiting Irina's cell before speaking to Eygon","17000504","..."
"#0Talk-1st time after accepting Irina's service","17000600","You've gone and rescued her, have you?"
"#0Talk-1st time after accepting Irina's service","17000601","How very quaint, pitying creatures that are beyond help."
"#0Talk-1st time after accepting Irina's service","17000602","..."
"#0Talk-1st time after accepting Irina's service","17000603","Very well. I'm sick of looking after her at any rate."
"#0Talk-1st time after accepting Irina's service","17000604","I am Eygon, a knight of Carim."
"#0Talk-1st time after accepting Irina's service","17000605","I am allied to you as long as you assure the girl's safety."
"#0Talk-1st time after accepting Irina's service","17000606","And only for that long..."
"#0Talk-2nd time after accepting Irina's service","17000700","What's the matter? My terms are very simple."
"#0Talk-2nd time after accepting Irina's service","17000701","I am allied to you for as long as you assure the girl's safety."
"#0Talk-2nd time after accepting Irina's service","17000702","And only for that long..."
"#0Talk-2nd time after accepting Irina's service","17000703","..."
"#0Talk-After accepting Irina's service before speaking to Eygon","17000800","Hmm... Another one of those Unkindled, are you?"
"#0Talk-After accepting Irina's service before speaking to Eygon","17000801","All you faceless Undead, behaving as if you deserve respect."
"#0Talk-After accepting Irina's service before speaking to Eygon","17000802","Now you've gone and rescued the wench..."
"#0Talk-After accepting Irina's service before speaking to Eygon","17000803","How very quaint, pitying creatures that are beyond help."
"#0Talk-After accepting Irina's service before speaking to Eygon","17000804","..."
"#0Talk-After accepting Irina's service before speaking to Eygon","17000805","Hmph, very well. I'm sick of looking after her at any rate."
"#0Talk-After accepting Irina's service before speaking to Eygon","17000806","I am Eygon, a knight of Carim."
"#0Talk-After accepting Irina's service before speaking to Eygon","17000807","I am allied to you for as long as you assure the girl's safety."
"#0Talk-After accepting Irina's service before speaking to Eygon","17000808","And only for that long..."
"#0Talk-1st time","17000901","Ahh, I know you. Been some time."
"#0Talk-1st time","17000902","I just dropped in to see how she's getting on."
"#0Talk-1st time","17000903","Now, what are you playing at with this circus?"
"#0Talk-1st time","17000904","This cesspool of
doddering oldfolk and degenerates."
"#0Talk-1st time","17000905","Couldn't be better. She must fit in perfectly here."
"#0Talk-1st time","17000906","..."
"#0Talk-1st time after summoning him as a White Phantom","17000900","Ahh, I know you. Been some time, since we met in person."
"#0Talk-1st time after summoning him as a White Phantom","17000902","I just dropped in to see how she's getting on."
"#0Talk-1st time after summoning him as a White Phantom","17000903","Now, what are you playing at with this circus?"
"#0Talk-1st time after summoning him as a White Phantom","17000904","This cesspool of
doddering oldfolk and degenerates."
"#0Talk-1st time after summoning him as a White Phantom","17000905","Couldn't be better. She must fit in perfectly here."
"#0Talk-1st time after summoning him as a White Phantom","17000906","..."
"#0Talk-2nd time","17001000","This place is a cesspool of
doddering oldfolk and degenerates."
"#0Talk-2nd time","17001001","Couldn't hope for better. She must fit in perfectly here."
"#0Talk-2nd time","17001002","..."
"#0Upon being attacked-1st time","17001203","What is it now!"
"#0Upon being attacked-2nd time","17001204","Curse you, damn fool!"
"#0Upon being attacked & made hostile","17001300","Lost it, have you?"
"#0Upon being attacked & made hostile","17001301","Then I'll take care of you."
"#0Upon being attacked & made hostile","17001302","As many times as it takes!"
"#0Upon killing the protagonist","17001400","Stay dead this time."
"#0Upon dying","17001502","Deluded Hollow bastard..."
"#0Upon dying","17001503","(No caption) Irina..."
"#0Upon approaching him after Irina has moved to the Firelink Shrine gravesite","17001100","I made myself very clear."
"#0Upon approaching him after Irina has moved to the Firelink Shrine gravesite","17001101","My allegiance remained only
as long as you assured the girl's safety."
"#0Upon approaching him after Irina has moved to the Firelink Shrine gravesite","17001102","This knight of Carim does not forgive betrayal."
"#0Upon approaching him after Irina has moved to the Firelink Shrine gravesite","17001103","Even a broken woman deserves her dignity..."
"#0Upon killing the protagonist in the Firelink Shrine gravesite","17001600","Remember. A knight of Carim does not forgive betrayal."
"#0Upon killing the protagonist in the Firelink Shrine gravesite","17001601","Not ever."
"#0Upon dying in the Firelink Shrine gravesite","17001700","..."
"#0Upon dying in the Firelink Shrine gravesite","17001503","(No caption) Irina..."
"#0Upon dying in the Firelink Shrine gravesite","17001200","##..."
"#0Upon dying in the Firelink Shrine gravesite","17001201","##..."
"#0Upon dying in the Firelink Shrine gravesite","17001500","##..."
"#0Upon dying in the Firelink Shrine gravesite","17001702","##You monster. Just how many souls have you eaten?"
